Type,Number,Company,Location,City,Province,Country,Latitude,Longitude
2,1,Cainiao,马昌营镇华夏大学对面,Beijing,Beijing,China,40.143401,117.029424
2,2,Cainiao,沙河镇兆丰家园6号楼6-7号底商,Beijing,Beijing,China,40.156397,116.28761
2,3,Cainiao,清河街道小营西路33号金山软件大厦1F员工服务中心后区,Beijing,Beijing,China,40.040778,116.322982
2,4,Cainiao,北京市通州区玉桥街道临河里方恒东景小区108号楼1单元103,Beijing,Beijing,China,39.878802,116.696854
2,5,Cainiao,黄村镇三合北巷7号院3号楼2单元1701,Beijing,Beijing,China,39.742225,116.326133
2,6,Cainiao,马家堡街道马家堡西里54号楼6门101室小卖部,Beijing,Beijing,China,39.857209,116.381559
2,7,Cainiao,檀营镇新北路檀营小区5号楼菜鸟驿站,Beijing,Beijing,China,40.395628,116.867395
2,8,Cainiao,北京市密云区果园街道季庄小区46号楼菜鸟驿站,Beijing,Beijing,China,40.384148,116.836464
2,9,Cainiao,北务镇郭家务村国林超市,Beijing,Beijing,China,40.071402,116.871194
2,10,Cainiao,义宾北区12号楼,Beijing,Beijing,China,40.140218,116.65495
2,11,Cainiao,北七家镇宏福苑北区3B楼三单元106,Beijing,Beijing,China,40.122767,116.373282
2,12,Cainiao,霍营街道龙锦苑东五区17号楼7单元602北门菜鸟驿站,Beijing,Beijing,China,40.092935,116.381618
2,13,Cainiao,东环路燕平家园34号楼,Beijing,Beijing,China,40.229388,116.246651
2,14,Cainiao,北京市昌平区城北街道三街财神庙胡同安福苑30号楼,Beijing,Beijing,China,40.232104,116.241203
2,15,Cainiao,昌盛路京科苑小区62号楼菜鸟驿站,Beijing,Beijing,China,40.216036,116.255696
2,16,Cainiao,城北街道亢山佳园小区5号楼菜鸟驿站,Beijing,Beijing,China,40.226645,116.261829
2,17,Cainiao,北京市昌平区马池口镇百泉庄百泉花园13号楼楼下菜鸟驿站,Beijing,Beijing,China,40.211614,116.218943
2,18,Cainiao,西环里47号楼菜鸟驿站,Beijing,Beijing,China,40.23628,116.230445
2,19,Cainiao,回龙观回龙观镇龙禧二街龙禧苑二区1号楼8号底商中商惠民君悦超市菜鸟驿站,Beijing,Beijing,China,40.091824,116.349302
2,20,Cainiao,北京市昌平区龙泽园街道回龙观天露园一区4号楼,Beijing,Beijing,China,40.091999,116.322921
2,21,Cainiao,北京市海淀区上庄镇上庄路与沙阳路馨瑞嘉园一号楼,Beijing,Beijing,China,40.131881,116.221977
2,22,Cainiao,南口镇兴隆街丰景高苑1号楼,Beijing,Beijing,China,40.24351,116.137794
2,23,Cainiao,北京市顺义区李桥镇馨港庄园二区20号楼菜鸟驿站,Beijing,Beijing,China,40.038714,116.674644
2,24,Cainiao,北京市通州区永顺镇北马庄翠福园小区19号楼,Beijing,Beijing,China,39.949739,116.660046
2,25,Cainiao,中仓街道中仓街道bobo自由城65号楼或者74号楼菜鸟驿站,Beijing,Beijing,China,39.914517,116.698707
2,26,Cainiao,北京市朝阳区常营镇五里桥二街1号院北京像素北区11号楼,Beijing,Beijing,China,39.932463,116.620999
2,27,Cainiao,北京市朝阳区立水桥立清路明天第一城7号院7号楼,Beijing,Beijing,China,40.052089,116.414599
2,28,Cainiao,东升镇观澳园1号楼菜鸟驿站,Beijing,Beijing,China,40.039857,116.377542
2,29,Cainiao,来广营镇来北家园4号楼,Beijing,Beijing,China,40.033626,116.4423
2,30,Cainiao,北京市朝阳区林萃西里43号楼,Beijing,Beijing,China,40.022389,116.375545
2,31,Cainiao,北京市朝阳区阜通东大街辅路,Beijing,Beijing,China,39.985971,116.475624
2,32,Cainiao,北京市朝阳区八里庄街道十里堡东里127号楼,Beijing,Beijing,China,39.925457,116.509585
2,33,Cainiao,朝阳北路八里庄南里小区8号楼佳和超市,Beijing,Beijing,China,39.928564,116.504637
2,34,Cainiao,北京市朝阳区和平街街道和平西街23号院2号楼,Beijing,Beijing,China,39.969123,116.423246
2,35,Cainiao,北京市西城区,Beijing,Beijing,China,39.966355,116.393167
2,36,Cainiao,北京市通州区九棵树东路115号,Beijing,Beijing,China,39.887907,116.676312
2,37,Cainiao,北京市朝阳区劲松街道劲松一区110号楼,Beijing,Beijing,China,39.89103,116.467404
2,38,Cainiao,北京市大兴区亦庄镇三羊里5号楼,Beijing,Beijing,China,39.82649,116.521161
2,39,Cainiao,台湖镇东居时代5号楼门口菜鸟驿站,Beijing,Beijing,China,39.831349,116.541732
2,40,Cainiao,白纸坊街道盆儿胡同双槐里小区十二号楼12-4华益生便民超市,Beijing,Beijing,China,39.88765,116.377147
2,41,Cainiao,北京市西城区椿树街道椿树园小区17号楼,Beijing,Beijing,China,39.899099,116.384647
2,42,Cainiao,大红门街道西罗园南里京品小区-47号楼菜鸟驿站,Beijing,Beijing,China,39.857889,116.399901
2,43,Cainiao,北京市丰台区和义街道南苑北里1区11号楼,Beijing,Beijing,China,39.816005,116.4045
2,44,Cainiao,灵秀山庄17号楼4单元201号菜鸟驿站,Beijing,Beijing,China,39.804392,116.467363
2,45,Cainiao,北京市大兴区瀛海镇南海家园二里9号楼,Beijing,Beijing,China,39.769259,116.495824
2,46,Cainiao,北京市大兴区旧宫镇成和园西区22号楼,Beijing,Beijing,China,39.812632,116.451589
2,47,Cainiao,北京市海淀区清河清景园4号楼,Beijing,Beijing,China,40.036566,116.358689
2,48,Cainiao,清缘里中区2号楼清源阳光超市,Beijing,Beijing,China,40.035894,116.362741
2,49,Cainiao,北京市昌平区西三旗龙乡小区中区14号楼,Beijing,Beijing,China,40.069076,116.343359
2,50,Cainiao,清河嘉园东区甲1号楼,Beijing,Beijing,China,40.036005,116.353072
2,51,Cainiao,西三旗街道西三旗东路3号沁春家园14号楼9单元602菜鸟驿站,Beijing,Beijing,China,40.063174,116.343085
2,52,Cainiao,北京市海淀区厢黄旗东路,Beijing,Beijing,China,40.03611,116.300974
2,53,Cainiao,学院路街道092t北京海淀区三环到四环之间展春园小区7号楼菜鸟驿站,Beijing,Beijing,China,39.995219,116.349083
2,54,Cainiao,北京市海淀区学院路街道城华园小区3号楼,Beijing,Beijing,China,40.016932,116.357419
2,55,Cainiao,知春路碧兴园一号楼下菜鸟驿站,Beijing,Beijing,China,39.980214,116.350268
2,56,Cainiao,三环到四环之间大钟寺东路168号太阳园太阳园3号楼菜鸟驿站,Beijing,Beijing,China,39.977186,116.345695
2,57,Cainiao,曙光街道曙光花园望河园4号楼菜鸟驿站,Beijing,Beijing,China,39.95115,116.296199
2,58,Cainiao,万寿路街道翠微东里10号楼底商龙岳达图片社,Beijing,Beijing,China,39.921525,116.313188
2,59,Cainiao,市万寿路街道静源居1号楼菜鸟驿站,Beijing,Beijing,China,39.917559,116.306015
2,60,Cainiao,万寿路街道复兴路46号院3号楼,Beijing,Beijing,China,39.911787,116.260196
2,61,Cainiao,北京市石景山区五里坨街道隆恩寺路19号院西山峻景小区4号楼,Beijing,Beijing,China,39.967964,116.130114
2,62,Cainiao,北京市石景山区金顶街街道金顶街四区10号楼,Beijing,Beijing,China,39.932815,116.178475
2,63,Cainiao,北京市丰台区华源四里8号楼,Beijing,Beijing,China,39.886013,116.326357
2,64,Cainiao,北京市丰台区前泥洼三区8号楼,Beijing,Beijing,China,39.860364,116.304856
2,65,Cainiao,望园东里24号楼楼下,Beijing,Beijing,China,39.87379,116.294417
2,66,Cainiao,丰葆路110号富锦嘉园一区12号楼下,Beijing,Beijing,China,39.823911,116.292578
2,67,Cainiao,北京市丰台区新村街道造甲街宝丰大厦菜鸟驿站,Beijing,Beijing,China,39.8483,116.303896
2,68,Cainiao,程庄北里5号楼,Beijing,Beijing,China,39.860927,116.272514
2,69,Cainiao,滨河西里北区9号楼,Beijing,Beijing,China,39.760292,116.345183
2,70,Cainiao,西红门镇广茂大街5号泰中花园4号楼菜鸟驿站,Beijing,Beijing,China,39.768209,116.353688
2,71,Cainiao,北京市大兴区盛芳茗苑18号楼,Beijing,Beijing,China,39.756587,116.344364
2,72,Cainiao,北京市大兴区黄村镇兴政西里20号楼,Beijing,Beijing,China,39.734488,116.342334
2,73,Cainiao,北京市大兴区首邑溪谷7号楼菜鸟驿站,Beijing,Beijing,China,39.76771,116.31792
2,74,Cainiao,北京市房山区拱辰街道天星街1号院6号楼菜鸟驿站,Beijing,Beijing,China,39.76141,116.16826
2,75,Cainiao,黄辛庄南里3号楼,Beijing,Beijing,China,39.759957,116.153958
2,76,Cainiao,拱辰街道拱辰大街楸树家园1号楼,Beijing,Beijing,China,39.740226,116.146177
2,77,Cainiao,北京市房山区燕化星城健德一里5号楼,Beijing,Beijing,China,39.719425,116.075271
2,78,Cainiao,北京市房山区大窦路腾龙家园二区1号楼101号,Beijing,Beijing,China,39.695422,116.071623
2,79,Cainiao,城关街道2号福胜家园8号楼菜鸟驿站,Beijing,Beijing,China,39.709322,115.994031
2,80,Cainiao,北京市密云区城后街25号,Beijing,Beijing,China,40.389797,116.847486
2,81,Cainiao,北京市密云区,Beijing,Beijing,China,40.378946,116.841232
2,82,Cainiao,学府花园22号楼菜鸟驿站,Beijing,Beijing,China,40.377414,116.830791
2,83,Cainiao,十里堡镇海怡庄园6号楼菜鸟驿站,Beijing,Beijing,China,40.370653,116.822278
2,84,Cainiao,中国果园街道学府花园9号楼菜鸟驿站,Beijing,Beijing,China,40.379925,116.828864
2,85,Cainiao,牛栏山前晏子中超顺发超市,Beijing,Beijing,China,40.206525,116.64126
2,86,Cainiao,胜利街道站前北街11号义宾南区7号楼前菜鸟驿站,Beijing,Beijing,China,40.137707,116.655527
2,87,Cainiao,北京市朝阳区滨河路(黄港国际创意园北侧约200米),Beijing,Beijing,China,40.085435,116.478526
2,88,Cainiao,东小口镇回南路8号院回南家园4号楼3单元-小区大门菜鸟驿站,Beijing,Beijing,China,40.092231,116.395448
2,89,Cainiao,霍营街道霍营华龙苑中里16号楼菜鸟驿站,Beijing,Beijing,China,40.085205,116.376795
2,90,Cainiao,城北街道东关北里2号楼菜鸟驿站,Beijing,Beijing,China,40.234184,116.247708
2,91,Cainiao,北京市昌平区城北街道建明里32号楼,Beijing,Beijing,China,40.226636,116.230677
2,92,Cainiao,北京市昌平区城角西路御路园21号楼,Beijing,Beijing,China,40.221594,116.229157
2,93,Cainiao,北京市昌平区北环里小区13号楼菜鸟驿站,Beijing,Beijing,China,40.232808,116.235144
2,94,Cainiao,邓庄村13号小金电脑手机维修,Beijing,Beijing,China,40.232328,116.205762
2,95,Cainiao,霍营龙跃苑四区26号楼菜鸟驿站,Beijing,Beijing,China,40.078433,116.355814
2,96,Cainiao,回龙观龙腾苑四区35号楼菜鸟驿站,Beijing,Beijing,China,40.078167,116.351229
2,97,Cainiao,北京市昌平区回龙观街道回龙观风雅园三区1号楼,Beijing,Beijing,China,40.086582,116.331933
2,98,Cainiao,李桥镇樱花园三区31号楼1门402或三区菜鸟驿站,Beijing,Beijing,China,40.035627,116.630984
2,99,Cainiao,北京市顺义区天竺镇蓝海苑5号楼,Beijing,Beijing,China,40.045761,116.603378
2,100,Cainiao,北京市通州区通瑞嘉苑21号楼,Beijing,Beijing,China,39.940178,116.694072
2,101,Cainiao,北京市通州区永顺镇永顺路44号财富东方4号楼,Beijing,Beijing,China,39.923689,116.659154
2,102,Cainiao,三间房镇金隅可乐a座菜鸟驿站,Beijing,Beijing,China,39.909218,116.582936
2,103,Cainiao,广顺北大街36号院望京西园二区203号楼2单元,Beijing,Beijing,China,40.009908,116.47901
2,104,Cainiao,北京市朝阳区望京街道南湖中园107号楼,Beijing,Beijing,China,40.008964,116.469089
2,105,Cainiao,北京市朝阳区大屯路辅路,Beijing,Beijing,China,40.008719,116.420603
2,106,Cainiao,北京市朝阳区六里屯街道八里庄北里小区317号楼,Beijing,Beijing,China,39.933361,116.506568
2,107,Cainiao,北京市朝阳区建外街道光辉南里小区3号楼,Beijing,Beijing,China,39.91195,116.48012
2,108,Cainiao,北京市朝阳区安贞街道安华西里一区4号楼,Beijing,Beijing,China,39.974501,116.404319
2,109,Cainiao,北京市通州区云景南大街62号附近,Beijing,Beijing,China,39.881409,116.665333
2,110,Cainiao,北京市通州区梨园镇九棵树通景园191号楼,Beijing,Beijing,China,39.884527,116.648516
2,111,Cainiao,梨园镇群芳园小区11号楼二单元,Beijing,Beijing,China,39.877754,116.67234
2,112,Cainiao,梨园葛布店东里9号楼413底商便民超市,Beijing,Beijing,China,39.897958,116.673544
2,113,Cainiao,北京市通州区怡乐北街蓝调沙龙12号楼211,Beijing,Beijing,China,39.893574,116.656892
2,114,Cainiao,劲松街道街道华腾园11号楼103菜鸟驿站,Beijing,Beijing,China,39.893547,116.473874
2,115,Cainiao,北京市丰台区南三环东路辅路,Beijing,Beijing,China,39.863906,116.44302
2,116,Cainiao,北京市丰台区芳群路,Beijing,Beijing,China,39.876581,116.432535
2,117,Cainiao,北京市西城区清芷园10号楼,Beijing,Beijing,China,39.879755,116.377875
2,118,Cainiao,北京市西城区陶然亭街道姚家井二巷1号楼,Beijing,Beijing,China,39.881767,116.381991
2,119,Cainiao,马家堡东路108号,Beijing,Beijing,China,39.847286,116.394932
2,120,Cainiao,远洋自然南门百福莱洗衣,Beijing,Beijing,China,39.848061,116.396006
2,121,Cainiao,瀛海镇南海家园三里北门,Beijing,Beijing,China,39.768284,116.504196
2,122,Cainiao,北京市海淀区西三旗街道永泰西里3号楼,Beijing,Beijing,China,40.038609,116.363036
2,123,Cainiao,北京市昌平区回龙观街道龙兴园中区9号楼,Beijing,Beijing,China,40.068305,116.326727
2,124,Cainiao,北京市海淀区黑山沪路甲17号附近,Beijing,Beijing,China,40.03019,116.271547
2,125,Cainiao,海淀街道大钟寺太阳园8号楼8号楼楼下菜鸟驿站,Beijing,Beijing,China,39.97708,116.348398
2,126,Cainiao,西直门北大街47号院一号楼隔壁家酒铺,Beijing,Beijing,China,39.954109,116.362319
2,127,Cainiao,中关村街道中关村东路102号金谷园1号楼菜鸟驿站,Beijing,Beijing,China,39.981285,116.341117
2,128,Cainiao,北京市海淀区常青园一区二号楼菜鸟驿站,Beijing,Beijing,China,39.961906,116.279431
2,129,Cainiao,万寿路八宝庄中区8号楼,Beijing,Beijing,China,39.928439,116.299925
2,130,Cainiao,北京市海淀区八里庄街道北洼路双紫小区甲29-2平价超市,Beijing,Beijing,China,39.94591,116.306323
2,131,Cainiao,西三环北路25号,Beijing,Beijing,China,39.938665,116.320604
2,132,Cainiao,北京市石景山区北工大北街,Beijing,Beijing,China,39.938256,116.213495
2,133,Cainiao,北京市石景山区,Beijing,Beijing,China,39.920224,116.207219
2,134,Cainiao,海特花园12号楼,Beijing,Beijing,China,39.93815,116.196839
2,135,Cainiao,苹果园街道西井一区8西井一区-1号楼菜鸟驿站,Beijing,Beijing,China,39.938486,116.202116
2,136,Cainiao,北京市石景山区鲁谷大街9附近,Beijing,Beijing,China,39.907438,116.235118
2,137,Cainiao,天宁寺前街南里8号楼,Beijing,Beijing,China,39.897303,116.350149
2,138,Cainiao,卢沟桥乡马连道高楼村高楼5号院3号楼楼下丰巢,Beijing,Beijing,China,39.878904,116.332364
2,139,Cainiao,北京市西城区广安门北街20号楼,Beijing,Beijing,China,39.897207,116.357329
2,140,Cainiao,北京市丰台区西客站南路太平桥东里18号楼菜鸟驿站,Beijing,Beijing,China,39.892078,116.328353
2,141,Cainiao,北京市丰台区近园路10号附近,Beijing,Beijing,China,39.867768,116.294098
2,142,Cainiao,靛厂路,Beijing,Beijing,China,39.895519,116.289089
2,143,Cainiao,北京市丰台区京开西路,Beijing,Beijing,China,39.833254,116.344271
2,144,Cainiao,北京市丰台区程庄北里19号楼,Beijing,Beijing,China,39.858811,116.27037
2,145,Cainiao,卢沟桥街道卢沟桥路五里店和光里小区15号楼菜鸟驿站,Beijing,Beijing,China,39.86576,116.264272
2,146,Cainiao,北京市石景山区鲁谷街道聚兴园小区5号楼,Beijing,Beijing,China,39.897342,116.230137
2,147,Cainiao,北京市丰台区二七车辆厂张郭庄22号楼菜鸟驿站,Beijing,Beijing,China,39.85771,116.202782
2,148,Cainiao,北京市丰台区明春东园24号楼菜鸟驿站,Beijing,Beijing,China,39.791806,116.30414
2,149,Cainiao,北京市大兴区清城南区2号楼菜鸟驿站,Beijing,Beijing,China,39.743044,116.334289
2,150,Cainiao,北京市大兴区滨河东里3号楼,Beijing,Beijing,China,39.758429,116.349054
2,151,Cainiao,北京市大兴区清源街道兴华园小区21号楼二单元菜鸟驿站,Beijing,Beijing,China,39.751774,116.340852
2,152,Cainiao,北京市大兴区黄村镇枣园东里1号楼,Beijing,Beijing,China,39.756095,116.341005
2,153,Cainiao,北京市大兴区兴丰街道黄村西大街65号阳光乐府21号楼,Beijing,Beijing,China,39.738662,116.334275
2,154,Cainiao,北京市房山区长阳镇加州水郡西区172号楼1单元101室,Beijing,Beijing,China,39.771957,116.165278
2,155,Cainiao,拱辰街道良乡东关ABC幼儿园西侧,Beijing,Beijing,China,39.737741,116.159045
2,156,Cainiao,北京市房山区S316(长虹东路),Beijing,Beijing,China,39.730425,116.144282
2,157,Cainiao,北京市房山区星城街道燕化星城健德二里16号楼菜鸟驿站,Beijing,Beijing,China,39.716128,116.071259
2,158,Cainiao,金海湖将军关新村93号小强超市,Beijing,Beijing,China,40.269116,117.327802
2,159,Cainiao,北京市密云区石桥西区26号楼,Beijing,Beijing,China,40.388632,116.873625
2,160,Cainiao,长安小区15号楼3单元,Beijing,Beijing,China,40.378015,116.848371
2,161,Cainiao,梨园镇翠屏北里东区207号楼菜鸟驿站,Beijing,Beijing,China,39.895692,116.657109
2,162,Cainiao,北京市朝阳区南磨房西大望路双龙南里220号楼底商便利超市,Beijing,Beijing,China,39.874228,116.486262
2,163,Cainiao,北京市朝阳区十八里店周庄嘉园6号院6号楼,Beijing,Beijing,China,39.865601,116.485124
2,164,Cainiao,北京市朝阳区市磨房北里小区133号楼,Beijing,Beijing,China,39.886562,116.483348
2,165,Cainiao,武圣东路松榆里社区松榆里12号楼楼下停车处,Beijing,Beijing,China,39.879083,116.478515
2,166,Cainiao,市南磨房镇御景园2号楼菜鸟驿站,Beijing,Beijing,China,39.874126,116.469099
2,167,Cainiao,北京市朝阳区北京工业大学北操场看台1层,Beijing,Beijing,China,39.882979,116.488691
2,168,Cainiao,北京市朝阳区公园路,Beijing,Beijing,China,39.857331,116.535593
2,169,Cainiao,北京市朝阳区十八里店南桥鸿博家园一期b区2号楼,Beijing,Beijing,China,39.837061,116.479278
2,170,Cainiao,北京市丰台区马家堡西里33号楼,Beijing,Beijing,China,39.858856,116.380766
2,171,Cainiao,北京市丰台区东铁匠营街道横一条甲18号院5号楼,Beijing,Beijing,China,39.856641,116.442873
2,172,Cainiao,北京市丰台区嘉园路辅路,Beijing,Beijing,China,39.855373,116.372509
2,173,Cainiao,北京市大兴区旧宫镇清逸园小区1号楼,Beijing,Beijing,China,39.809416,116.453118
2,174,Cainiao,回龙观街道龙乡中区10号楼菜鸟驿站,Beijing,Beijing,China,40.068344,116.343391
2,175,Cainiao,回龙观新康园小区南门12号楼底商家百惠超市,Beijing,Beijing,China,40.070543,116.355507
2,176,Cainiao,北京市海淀区清河街道安宁庄西路2号安宁庄西路9号院25号楼,Beijing,Beijing,China,40.047834,116.322693
2,177,Cainiao,北京市海淀区,Beijing,Beijing,China,40.027346,116.350927
2,178,Cainiao,学院路街道清华东路27号院5号楼菜鸟驿站,Beijing,Beijing,China,40.006996,116.357341
2,179,Cainiao,学院路14号院15号楼前小停车场菜鸟驿站,Beijing,Beijing,China,40.008472,116.358021
2,180,Cainiao,温泉镇白家疃西口尚峰尚水尚品园3号楼1单元菜鸟驿站,Beijing,Beijing,China,40.050049,116.191491
2,181,Cainiao,青龙桥街道红山口甲三号,Beijing,Beijing,China,40.024265,116.272801
2,182,Cainiao,北京市西城区北礼士路103号平价超市,Beijing,Beijing,China,39.940037,116.359696
2,183,Cainiao,展览路街道甘家口1号楼,Beijing,Beijing,China,39.931499,116.33596
2,184,Cainiao,三环到四环之间海淀定慧东里24号楼菜鸟驿站,Beijing,Beijing,China,39.927428,116.292277
2,185,Cainiao,定慧西里20号楼菜鸟驿站,Beijing,Beijing,China,39.928957,116.289045
2,186,Cainiao,北京市海淀区四季青镇四季青常青园一区7号楼,Beijing,Beijing,China,39.961833,116.277343
2,187,Cainiao,椿楸嘉园11号楼1单元602室西门菜鸟驿站,Beijing,Beijing,China,39.943747,116.259243
2,188,Cainiao,苹果园街道西黄新村北里12号楼菜鸟驿站,Beijing,Beijing,China,39.941925,116.20947
2,189,Cainiao,金顶阳光枫景园3号楼菜鸟驿站,Beijing,Beijing,China,39.935687,116.173262
2,190,Cainiao,北京市石景山区金顶街街道金顶阳光柳青园9号楼,Beijing,Beijing,China,39.934254,116.170713
2,191,Cainiao,北京市石景山区金顶北路18号院13号楼,Beijing,Beijing,China,39.932829,116.172771
2,192,Cainiao,北京市丰台区右安门街道右安门外玉林里37号楼,Beijing,Beijing,China,39.869143,116.365736
2,193,Cainiao,丰台街道丰台北路庄维花园4号楼菜鸟驿站,Beijing,Beijing,China,39.870606,116.296295
2,194,Cainiao,文体路永善里2号楼,Beijing,Beijing,China,39.855146,116.292584
2,195,Cainiao,狼垡一村停车场旁菜鸟驿站,Beijing,Beijing,China,39.783442,116.293387
2,196,Cainiao,北京市房山区市房山区长阳镇金地朗悦一期7号楼,Beijing,Beijing,China,39.738394,116.198988
2,197,Cainiao,长阳镇九洲溪雅苑二区15号楼菜鸟驿站,Beijing,Beijing,China,39.778077,116.185647
2,198,Cainiao,北京市房山区黄辛庄东里15号楼菜鸟驿站,Beijing,Beijing,China,39.761646,116.154747
2,199,Cainiao,北京市房山区拱辰街道东羊庄新村二号楼菜鸟驿站,Beijing,Beijing,China,39.735801,116.170989
2,200,Cainiao,北京市大兴区采育镇育新花园中里a区14号楼,Beijing,Beijing,China,39.664336,116.641989
2,201,Cainiao,新源时代小区2号楼4单元菜鸟驿站,Beijing,Beijing,China,39.696905,116.334217
2,202,Cainiao,星城街道燕化星城健德二里28号楼菜鸟驿站,Beijing,Beijing,China,39.713888,116.070501
2,203,Cainiao,北京市房山区城关镇前朱各庄安置房1号楼,Beijing,Beijing,China,39.720006,116.018402
2,204,Cainiao,马家堡街道北京市丰台区马家堡西路26号流星院2号楼107天天超市,Beijing,Beijing,China,39.847685,116.37803
2,205,Cainiao,北京市房山区文化路16号楼,Beijing,Beijing,China,39.740829,116.151298
2,206,Cainiao,望楚村一区7号,Beijing,Beijing,China,39.66336,116.089342
2,207,Cainiao,长阳镇107国道聚客联益旁边,Beijing,Beijing,China,39.739907,116.228498
2,208,Cainiao,北京市昌平区水厂路甲12号,Beijing,Beijing,China,40.239557,116.134257
2,209,Cainiao,良乡大学城站路南首创紫悦台,Beijing,Beijing,China,39.726416,116.187616
2,210,Cainiao,北京市通州区新建村二期高层10号楼3单元101室,Beijing,Beijing,China,39.938621,116.648869
2,211,Cainiao,北京市海淀区八里庄街道八里庄路62号院2号楼,Beijing,Beijing,China,39.934699,116.284582
2,212,Cainiao,沙河镇北街家园6区21号楼底商109百世,Beijing,Beijing,China,40.166928,116.264673
2,213,Cainiao,北京市朝阳区常营镇北京像素南区8号楼,Beijing,Beijing,China,39.932721,116.624921
2,214,Cainiao,西罗园街道角门东里5号楼105号楼后食品店香烟冷饮批发店,Beijing,Beijing,China,39.855198,116.389565
2,215,Cainiao,城南街道凉水河路龙山跃1号院2号楼110号便民超市,Beijing,Beijing,China,40.205313,116.240456
2,216,Cainiao,小红门鸿博家园一期B区南门底商洋河蓝色经典名呀名酒超市,Beijing,Beijing,China,39.834757,116.479722
2,217,Cainiao,北京市大兴区后辛庄村永华路13号,Beijing,Beijing,China,39.727491,116.28493
2,218,Cainiao,北京市丰台区警备东路53号,Beijing,Beijing,China,39.809529,116.408507
2,219,Cainiao,北京市朝阳区左家庄西街8号楼5单元东102室,Beijing,Beijing,China,39.95875,116.446942
2,220,Cainiao,三间房建国路18号院珠江绿洲8号楼104室,Beijing,Beijing,China,39.913162,116.565165
2,221,Cainiao,新建村二期高层4号楼一单元104,Beijing,Beijing,China,39.935126,116.651859
2,222,Cainiao,卢沟桥街道莲怡园北路1号院2号楼8门101号便民商店,Beijing,Beijing,China,39.892658,116.304431
2,223,Cainiao,北京市朝阳区黑庄户万子营东村电脑维修(万子营西村活动中心向东150米),Beijing,Beijing,China,39.868669,116.603667
2,224,Cainiao,周口店镇新街大街7号,Beijing,Beijing,China,39.663436,115.945146
2,225,Cainiao,北京市大兴区明春西园9号楼,Beijing,Beijing,China,39.79209,116.295566
2,226,Cainiao,南彩镇彩俸小区1号楼1单元底商三龙胜发商店,Beijing,Beijing,China,40.135133,116.709372
2,227,Cainiao,长辛店街道张郭庄二七车辆厂小区27楼招待所处菜鸟驿站,Beijing,Beijing,China,39.858307,116.203539
2,228,Cainiao,万寿路街道万寿路一号院9号楼洗衣店,Beijing,Beijing,China,39.925057,116.292576
2,229,Cainiao,北京市通州区台湖镇蒋辛庄131号,Beijing,Beijing,China,39.820341,116.643983
2,230,Cainiao,逸成东苑2号楼3单元101室(东区),Beijing,Beijing,China,40.019841,116.357561
2,231,Cainiao,长辛店街道张郭庄南路单身宿舍4楼底商65号名烟名酒,Beijing,Beijing,China,39.855304,116.203612
2,232,Cainiao,长阳镇加州水郡西区151栋36号恒协干洗,Beijing,Beijing,China,39.776873,116.170934
2,233,Cainiao,长辛店镇长兴路12号中体奥园一区1号楼105北京兴盛康医药,Beijing,Beijing,China,39.841844,116.198366
2,234,Cainiao,西红门镇南四条团河村社区卫生服务站对面,Beijing,Beijing,China,39.752932,116.390568
2,235,Cainiao,清源街道北京市大兴区康庄路53号院康泰园小区7号楼2单元101,Beijing,Beijing,China,39.763391,116.316789
2,236,Cainiao,温榆河西路西100米,Beijing,Beijing,China,39.936253,116.651025
2,237,Cainiao,北京市昌平区立水桥西路,Beijing,Beijing,China,40.069043,116.415156
2,238,Cainiao,小汤山镇赴沟路土沟新村南区22号楼5-102,Beijing,Beijing,China,40.15911,116.463937
2,239,Cainiao,北京市昌平区府学路宁馨苑1号楼商业10号北京康安亿家净环保科技有限公司,Beijing,Beijing,China,40.227357,116.265502
