Type,Number,Company,Location,City,Province,Country,Latitude,Longitude
2,240,Cainiao,大东新村学步街32-4,Beijing,Beijing,China,39.682935,116.534317
2,241,Cainiao,望京花家地方舟苑6号楼103室超市水站(方舟苑店),Beijing,Beijing,China,39.985089,116.471536
2,242,Cainiao,风雅园一区18号楼花语贝思儿童摄影内,Beijing,Beijing,China,40.090513,116.328806
2,243,Cainiao,孙河北京市朝阳区孙河康营十五区四号楼一单元104,Beijing,Beijing,China,40.043078,116.547575
2,244,Cainiao,北京市朝阳区安贞街道安贞里一区27号楼,Beijing,Beijing,China,39.981184,116.408537
2,245,Cainiao,拱辰街道拱辰大街阳光邑上41-7,Beijing,Beijing,China,39.735766,116.168141
2,246,Cainiao,宋庄镇内军庄村临16号振新超市,Beijing,Beijing,China,40.013009,116.70993
2,247,Cainiao,呼家楼街道向军北里28号院2号楼101,Beijing,Beijing,China,39.930772,116.465961
2,248,Cainiao,回龙观北京市昌平区回龙观龙博苑一区3号楼110底商便民超市,Beijing,Beijing,China,40.075337,116.342535
2,249,Cainiao,海特花园26号楼车棚北京市利君雪静食品店,Beijing,Beijing,China,39.939732,116.19053
2,250,Cainiao,金海湖将军关新村93号小强超市,Beijing,Beijing,China,40.268916,117.327795
2,251,Cainiao,北京市顺义区马坡中晟馨苑小区4号院3号楼1单元104室,Beijing,Beijing,China,40.176403,116.639798
2,252,Cainiao,北京市朝阳区华严北里52号楼(金渝饭店对面)北京鼎鑫电脑维修中心,Beijing,Beijing,China,39.988813,116.390171
2,253,Cainiao,回龙观龙锦三街龙锦苑东三区1号楼超市,Beijing,Beijing,China,40.090088,116.375676
2,254,Cainiao,北七家镇北京市昌平区白各庄新村28号楼4单元102,Beijing,Beijing,China,40.12019,116.360817
2,255,Cainiao,北京市海淀区四道口2号院1号楼一层98全家便利店,Beijing,Beijing,China,39.964818,116.357962
2,256,Cainiao,张坊镇张坊村城门楼门口向北沿主路500米路边北京特产店(韵达旁),Beijing,Beijing,China,39.579387,115.718544
2,257,Cainiao,马坊村317号,Beijing,Beijing,China,40.161259,116.413745
2,258,Cainiao,天通苑南街道北京市昌平区天通苑东一区33号楼3单元101底商,Beijing,Beijing,China,40.071114,116.440532
2,259,Cainiao,双清路30号清华大学五区93号,Beijing,Beijing,China,40.000314,116.331151
